{
  "name": "Upper/Lower RPE block",
  "unit": "kg",
  "weeks": 4,
  "days": [
    {
      "name": "Upper A",
      "groups": [
        {"rest_s": 180, "exercises": [
          {"slug": "barbell-bench-press",
           "alternatives": ["dumbbell-bench-press"],
           "notes": "pause first rep",
           "sets": [
             {"kind": "warmup", "count": 2, "reps": 5, "load": {"pct_tm": 0.5}},
             {"count": [3, 3, 4, 2], "reps": 5, "load": {"rpe": [7, 8, 9, 6]}},
             {"kind": "drop", "count": [1, 1, 1, null], "reps": 10, "load": {"drop_pct": 0.2}}
           ]}]},
        {"rest_s": [90, 90, 90, 60], "exercises": [
          {"slug": "pull-up", "sets": [{"count": 3, "reps": "6-10", "rpe": 8}]},
          {"slug": "cable-lateral-raise", "sets": [{"count": 3, "reps": 15, "load": {"weight": 7.5}}]}
        ]}
      ]
    },
    {
      "name": "Lower A",
      "groups": [
        {"exercises": [
          {"slug": "barbell-back-squat", "sets": [{"count": [5, 4, 3, 2], "reps": [5, 4, 3, 5], "load": {"pct_tm": [0.75, 0.8, 0.85, 0.6]}}]}
        ]},
        {"exercises": [{"slug": "plank", "sets": [{"count": 3, "duration_s": [45, 50, 55, 30]}]}]}
      ]
    },
    {"name": "Deload extra", "only_weeks": [4], "groups": [
      {"exercises": [{"slug": "dumbbell-curl", "sets": [{"count": 2, "reps": "AMRAP", "load": {"weight": 10}}]}]}
    ]}
  ]
}
